{
  "$schema": "https://json-schema.org/draft/2020-12/schema",
  "$id": "https://schemas.bcinexus.xyz/pipeline.schema.json",
  "title": "BCINexus Pipeline Artifact",
  "type": "object",
  "required": ["id", "name", "version", "steps"],
  "additionalProperties": false,
  "properties": {
    "id": {
      "type": "string",
      "minLength": 1
    },
    "name": {
      "type": "string",
      "minLength": 1
    },
    "version": {
      "type": "string",
      "minLength": 1
    },
    "modality": {
      "type": "string",
      "examples": ["EEG", "fNIRS", "EMG", "multimodal"]
    },
    "steps": {
      "type": "array",
      "items": {
        "type": "object",
        "required": ["id", "type"],
        "additionalProperties": true,
        "properties": {
          "id": {
            "type": "string"
          },
          "type": {
            "type": "string"
          },
          "parameters": {
            "type": "object",
            "additionalProperties": true
          }
        }
      }
    },
    "metadata": {
      "type": "object",
      "additionalProperties": true
    }
  }
}
